[
  {
    "test_case_id": "TC-ACT-0001",
    "traces_to_llr": "LLR-ACT-0001",
    "test_category": "NOMINAL",
    "description": "Verify nominal execution of actuator_set_position within specified operating ranges.",
    "inputs": {
      "channel": 1,
      "target_angle_deg": 0.0
    },
    "expected_outputs": {
      "status": "SUCCESS",
      "error_flag": 0
    },
    "fault_injection": null
  },
  {
    "test_case_id": "TC-ACT-0002",
    "traces_to_llr": "LLR-ACT-0001",
    "test_category": "BOUNDARY",
    "description": "Verify actuator_set_position lower bound behavior at Xmin (0) for parameter 'channel'.",
    "inputs": {
      "channel": 0,
      "target_angle_deg": 0.0
    },
    "expected_outputs": {
      "status": "SUCCESS",
      "error_flag": 0
    },
    "fault_injection": null
  },
  {
    "test_case_id": "TC-ACT-0003",
    "traces_to_llr": "LLR-ACT-0001",
    "test_category": "BOUNDARY",
    "description": "Verify actuator_set_position upper bound behavior at Xmax (3) for parameter 'channel'.",
    "inputs": {
      "channel": 3,
      "target_angle_deg": 0.0
    },
    "expected_outputs": {
      "status": "SUCCESS",
      "error_flag": 0
    },
    "fault_injection": null
  },
  {
    "test_case_id": "TC-ACT-0004",
    "traces_to_llr": "LLR-ACT-0001",
    "test_category": "BOUNDARY",
    "description": "Verify actuator_set_position lower bound behavior at Xmin (-45.0) for parameter 'target_angle_deg'.",
    "inputs": {
      "channel": 1,
      "target_angle_deg": -45.0
    },
    "expected_outputs": {
      "status": "SUCCESS",
      "error_flag": 0
    },
    "fault_injection": null
  },
  {
    "test_case_id": "TC-ACT-0005",
    "traces_to_llr": "LLR-ACT-0001",
    "test_category": "BOUNDARY",
    "description": "Verify actuator_set_position upper bound behavior at Xmax (45.0) for parameter 'target_angle_deg'.",
    "inputs": {
      "channel": 1,
      "target_angle_deg": 45.0
    },
    "expected_outputs": {
      "status": "SUCCESS",
      "error_flag": 0
    },
    "fault_injection": null
  },
  {
    "test_case_id": "TC-ACT-0006",
    "traces_to_llr": "LLR-ACT-0001",
    "test_category": "ROBUSTNESS",
    "description": "Robustness: Invalidate input parameters to verify defensive containment in actuator_set_position.",
    "inputs": {
      "channel": 9999,
      "target_angle_deg": 9999
    },
    "expected_outputs": {
      "status": "ERR_RANGE_VIOLATION",
      "error_flag": 1
    },
    "fault_injection": "Out-of-range parameter injection beyond allowed envelope"
  },
  {
    "test_case_id": "TC-ACT-0007",
    "traces_to_llr": "LLR-ACT-0001",
    "test_category": "ROBUSTNESS",
    "description": "Robustness: Simulate hardware interface timeout and loss of bus synchronization.",
    "inputs": {
      "channel": 1,
      "target_angle_deg": 0.0
    },
    "expected_outputs": {
      "status": "ERR_TIMEOUT",
      "error_flag": 1
    },
    "fault_injection": "Hardware interface timeout: READY bit held low indefinitely"
  },
  {
    "test_case_id": "TC-ACT-0008",
    "traces_to_llr": "LLR-ACT-0002",
    "test_category": "NOMINAL",
    "description": "Verify nominal execution of actuator_switch_mode within specified operating ranges.",
    "inputs": {
      "mode": 1
    },
    "expected_outputs": {
      "status": "SUCCESS",
      "error_flag": 0
    },
    "fault_injection": null
  },
  {
    "test_case_id": "TC-ACT-0009",
    "traces_to_llr": "LLR-ACT-0002",
    "test_category": "BOUNDARY",
    "description": "Verify actuator_switch_mode lower bound behavior at Xmin (0) for parameter 'mode'.",
    "inputs": {
      "mode": 0
    },
    "expected_outputs": {
      "status": "SUCCESS",
      "error_flag": 0
    },
    "fault_injection": null
  },
  {
    "test_case_id": "TC-ACT-0010",
    "traces_to_llr": "LLR-ACT-0002",
    "test_category": "BOUNDARY",
    "description": "Verify actuator_switch_mode upper bound behavior at Xmax (2) for parameter 'mode'.",
    "inputs": {
      "mode": 2
    },
    "expected_outputs": {
      "status": "SUCCESS",
      "error_flag": 0
    },
    "fault_injection": null
  },
  {
    "test_case_id": "TC-ACT-0011",
    "traces_to_llr": "LLR-ACT-0002",
    "test_category": "ROBUSTNESS",
    "description": "Robustness: Invalidate input parameters to verify defensive containment in actuator_switch_mode.",
    "inputs": {
      "mode": 9999
    },
    "expected_outputs": {
      "status": "ERR_RANGE_VIOLATION",
      "error_flag": 1
    },
    "fault_injection": "Out-of-range parameter injection beyond allowed envelope"
  },
  {
    "test_case_id": "TC-ACT-0012",
    "traces_to_llr": "LLR-ACT-0002",
    "test_category": "ROBUSTNESS",
    "description": "Robustness: Simulate hardware interface timeout and loss of bus synchronization.",
    "inputs": {
      "mode": 1
    },
    "expected_outputs": {
      "status": "ERR_TIMEOUT",
      "error_flag": 1
    },
    "fault_injection": "Hardware interface timeout: READY bit held low indefinitely"
  }
]